Cluster,Keyword,Intent,Usage Note
Primary,grandma memory journal,Core product search,"Use in title/subtitle testing if relevant and original."
Primary,grandmother keepsake journal,Core product search,"Use in description and backend keyword brainstorming."
Primary,grandma tell me your story book,Known format search,"Check trademark and close competitor duplication before using."
Primary,family history journal for grandma,Outcome-led search,"Use when emphasizing preserved stories."
Primary,guided journal for grandmother,Format-led search,"Use when interior is genuinely guided."
Buyer intent,gift for grandma,Gift shopping,"Use in bullets or image captions."
Buyer intent,Mother's Day gift for grandmother,Occasion search,"Use only when seasonal listing assets match."
Buyer intent,birthday gift for grandma,Occasion search,"Useful for evergreen gift positioning."
Buyer intent,family keepsake gift,Outcome search,"Use to support emotional promise."
Buyer intent,journal for grandparents,Adjacent recipient search,"Use for research, not as the main angle if product is grandma-specific."
Differentiation,legacy stories,Emotional outcome,"Use in promise and section naming."
Differentiation,family recipes and traditions,Interior feature,"Use only if included in the book."
Differentiation,letters to grandchildren,Interior feature,"Use only if included in the book."
Differentiation,photo and keepsake pages,Interior feature,"Use only if included in the book."
Differentiation,simple large-writing prompts,Accessibility feature,"Use only if interior design supports larger writing space."
