date_added,brand,contact_name,channel,status,offer_fit,speed_to_value,async_fit,proof_fit,total_score,problem_observed,next_action,last_touch_date,notes
2026-04-20,Jonathan Dunnett,Jonathan Dunnett,email,new,2,2,2,2,8,"Call-first sales path for keynote speaker coaching; clear business-development pain but no visible async starter offer on /book-a-call.","Send cold email with teardown focused on async inquiry flow and a low-friction starter asset.",,"Source: jonathandunnett.com/book-a-call. Angle: add async teardown, form routing, and follow-up for speaker leads."
2026-04-20,Jamie White,Jamie White,email,new,2,1,1,2,6,"Application + compatibility-call flow is high friction and phone-heavy for a coaching offer that could pre-qualify async first.","Send cold email offering a simpler async application + follow-up sequence concept.",,"Source: jamiewhite.com/private-coaching. Angle: reduce friction before the compatibility call."
2026-04-20,Sarah Raanan,Sarah Raanan,email,new,2,2,2,2,8,"Two separate discovery-call CTAs for business coaching and content strategy, but no async lead magnet or follow-up path tied directly to those services.","Send cold email with teardown around async inquiry segmentation and follow-up automation.",,"Source: sarahraanan.com/book-a-call. Angle: convert call-page traffic into segmented async leads."
2026-04-20,Mr. CTO,Mr. CTO,email,new,2,2,2,2,8,"Strong positioning, but 'fill out the form below' and broad service framing leave room for a tighter async qualification path and offer-specific routing.","Send short email pitching a cleaner work-with-me funnel and qualification flow.",,"Source: themrcto.com/work-with-me. Angle: sharper routing for founders vs engineers vs teams."
2026-04-20,Negstad Consulting,Lisa Negstad,email,new,1,1,2,1,5,"Broad service mix across training, coaching, advising, and facilitation; likely opportunity to tighten inquiry segmentation and async qualification.","Send email with niche-specific intake restructuring idea.",,"Source: negstadconsulting.com/work. Angle: separate team training inquiries from advisory/coaching leads."
2026-04-20,Lillian So,Lillian So,email,new,2,2,1,2,7,"Application page is persuasive but still pushes discovery-call style next steps; possible fit for an async intake and follow-up system.","Send short personalized email offering an async lead-capture teardown.",,"Source: meetlillianso.com/apply. Angle: build a softer entry path before private coaching application."
2026-04-20,Sally Grisedale,Sally Grisedale,email,new,2,2,1,1,6,"Discovery-call page relies on free 30-minute call booking; no obvious async offer layer for creative leaders not ready to book immediately.","Send cold email around adding async starter offer and nurture sequence.",,"Source: sallygrisedale.com/book-a-call. Angle: capture interested but not ready buyers."
2026-04-20,Coach with Mindy,Mindy,email,new,2,2,1,1,6,"Multiple call options create choice overload and still require synchronous booking; likely room for simpler inquiry routing and follow-up.","Send teardown-focused email suggesting one primary CTA with follow-up logic.",,"Source: coachwithmindy.com/book-a-call. Angle: reduce CTA sprawl and capture warmer leads."
